15:28:46.539147 IP 10.31.27.252.1985 > 224.0.0.102.1985: UDP, length 52
15:28:47.479137 IP 10.31.26.186.5353 > 224.0.0.251.5353: UDP, length 90
15:28:47.479217 IP 10.31.26.216.5353 > 224.0.0.251.5353: UDP, length 153
15:28:48.105882 IP 10.31.27.253.1985 > 224.0.0.102.1985: UDP, length 52
15:28:48.628196 IP 10.33.14.206.5353 > 224.0.0.251.5353: UDP, length 32
15:28:48.628287 IP 10.10.251.232 > 224.0.0.1: igmp
15:28:49.254752 IP 10.31.27.252.1985 > 224.0.0.102.1985: UDP, length 52
15:28:49.359230 IP 10.31.26.216.5353 > 224.0.0.251.5353: UDP, length 200
15:28:49.672578 IP 10.31.26.216.5353 > 224.0.0.251.5353: UDP, length 153
15:28:49.881483 IP 10.33.14.37.5353 > 224.0.0.251.5353: UDP, length 90
15:28:50.194885 IP 10.31.24.175.5353 > 224.0.0.251.5353: UDP, length 90
15:28:50.299328 IP 10.33.14.68.5353 > 224.0.0.251.5353: UDP, length 61
15:28:50.403757 IP 10.33.14.68.5353 > 224.0.0.251.5353: UDP, length 114
15:28:50.508240 IP 10.31.26.216.5353 > 224.0.0.251.5353: UDP, length 200
15:28:50.717141 IP 10.31.27.253.1985 > 224.0.0.102.1985: UDP, length 52
15:28:50.909572 IP 10.31.24.241.6546 > 129.186.140.200.53: UDP, length 33
15:28:50.909744 IP 10.31.24.241.57358 > 129.186.140.200.53: UDP, length 33
15:28:50.924455 IP 129.186.140.200.53 > 10.31.24.241.6546: UDP, length 49
15:28:50.924478 IP 129.186.140.200.53 > 10.31.24.241.57358: UDP, length 61
15:28:50.925952 IP 10.33.14.37.5353 > 224.0.0.251.5353: UDP, length 90
15:28:51.436964 IP 10.31.24.241 > 224.0.0.251: igmp
15:28:51.813457 IP 10.31.24.241.62513 > 172.217.1.69.443: tcp 1346
15:28:51.813538 IP 10.31.24.241.62513 > 172.217.1.69.443: tcp 39
15:28:51.813573 IP 10.31.24.241.62513 > 172.217.1.69.443: tcp 1368
15:28:51.813586 IP 10.31.24.241.62513 > 172.217.1.69.443: tcp 931
15:28:51.848832 IP 172.217.1.69.443 > 10.31.24.241.62513: tcp 0
15:28:51.848845 IP 172.217.1.69.443 > 10.31.24.241.62513: tcp 0
15:28:51.848851 IP 172.217.1.69.443 > 10.31.24.241.62513: tcp 0
15:28:51.848856 IP 172.217.1.69.443 > 10.31.24.241.62513: tcp 0
15:28:51.848861 IP 172.217.1.69.443 > 10.31.24.241.62513: tcp 39
15:28:51.848904 IP 10.31.24.241.62513 > 172.217.1.69.443: tcp 0
15:28:51.970403 IP 10.31.27.252.1985 > 224.0.0.102.1985: UDP, length 52
15:28:52.180312 IP 172.217.1.69.443 > 10.31.24.241.62513: tcp 232
15:28:52.180344 IP 10.31.24.241.62513 > 172.217.1.69.443: tcp 0
15:28:52.180494 IP 172.217.1.69.443 > 10.31.24.241.62513: tcp 1418
15:28:52.180505 IP 172.217.1.69.443 > 10.31.24.241.62513: tcp 1418
15:28:52.180513 IP 172.217.1.69.443 > 10.31.24.241.62513: tcp 154
15:28:52.180520 IP 172.217.1.69.443 > 10.31.24.241.62513: tcp 1418
15:28:52.180527 IP 172.217.1.69.443 > 10.31.24.241.62513: tcp 865
15:28:52.180535 IP 172.217.1.69.443 > 10.31.24.241.62513: tcp 1418
15:28:52.180557 IP 10.31.24.241.62513 > 172.217.1.69.443: tcp 0
15:28:52.180571 IP 10.31.24.241.62513 > 172.217.1.69.443: tcp 0
15:28:52.180596 IP 10.31.24.241.62513 > 172.217.1.69.443: tcp 0
15:28:52.180608 IP 10.31.24.241.62513 > 172.217.1.69.443: tcp 0
15:28:52.180617 IP 10.31.24.241.62513 > 172.217.1.69.443: tcp 0
15:28:52.180625 IP 10.31.24.241.62513 > 172.217.1.69.443: tcp 0
15:28:52.180659 IP 172.217.1.69.443 > 10.31.24.241.62513: tcp 1418
15:28:52.180669 IP 172.217.1.69.443 > 10.31.24.241.62513: tcp 284
15:28:52.180676 IP 172.217.1.69.443 > 10.31.24.241.62513: tcp 1418
15:28:52.180684 IP 172.217.1.69.443 > 10.31.24.241.62513: tcp 1418
15:28:52.180691 IP 172.217.1.69.443 > 10.31.24.241.62513: tcp 1172
15:28:52.180697 IP 172.217.1.69.443 > 10.31.24.241.62513: tcp 88
15:28:52.180713 IP 10.31.24.241.62513 > 172.217.1.69.443: tcp 0
15:28:52.180723 IP 10.31.24.241.62513 > 172.217.1.69.443: tcp 0
15:28:52.180733 IP 10.31.24.241.62513 > 172.217.1.69.443: tcp 0
15:28:52.180742 IP 10.31.24.241.62513 > 172.217.1.69.443: tcp 0
15:28:52.180753 IP 10.31.24.241.62513 > 172.217.1.69.443: tcp 0
15:28:52.180762 IP 10.31.24.241.62513 > 172.217.1.69.443: tcp 0
15:28:52.180849 IP 172.217.1.69.443 > 10.31.24.241.62513: tcp 118
15:28:52.180858 IP 172.217.1.69.443 > 10.31.24.241.62513: tcp 39
15:28:52.180880 IP 10.31.24.241.62513 > 172.217.1.69.443: tcp 0
15:28:52.180893 IP 10.31.24.241.62513 > 172.217.1.69.443: tcp 0
15:28:52.181271 IP 10.31.24.241.62513 > 172.217.1.69.443: tcp 0
15:28:52.182324 IP 10.31.24.241.62513 > 172.217.1.69.443: tcp 39
15:28:52.258847 IP 172.217.1.69.443 > 10.31.24.241.62513: tcp 0
15:28:52.283740 IP 10.31.24.62.5353 > 224.0.0.251.5353: UDP, length 61
15:28:52.492597 IP 10.31.26.216.5353 > 224.0.0.251.5353: UDP, length 200
15:28:52.806017 IP 10.31.25.44.53907 > 224.0.0.252.5355: UDP, length 33
15:28:53.223724 IP 10.31.25.44.53907 > 224.0.0.252.5355: UDP, length 33
15:28:53.432690 IP 10.31.27.253.1985 > 224.0.0.102.1985: UDP, length 52
15:28:53.641570 IP 10.31.26.216.5353 > 224.0.0.251.5353: UDP, length 153
15:28:53.745968 IP 10.31.25.98.5353 > 224.0.0.251.5353: UDP, length 139
15:28:53.802849 IP 10.31.24.241.5353 > 10.31.25.98.5353: UDP, length 385
15:28:53.937713 IP 10.31.24.241.62513 > 172.217.1.69.443: tcp 1368
15:28:53.937737 IP 10.31.24.241.62513 > 172.217.1.69.443: tcp 1368
15:28:53.937748 IP 10.31.24.241.62513 > 172.217.1.69.443: tcp 359
15:28:53.949298 IP 10.31.24.241.62513 > 172.217.1.69.443: tcp 1368
15:28:53.949324 IP 10.31.24.241.62513 > 172.217.1.69.443: tcp 1368
15:28:53.949336 IP 10.31.24.241.62513 > 172.217.1.69.443: tcp 299
15:28:53.954844 IP 10.33.14.37.5353 > 224.0.0.251.5353: UDP, length 90
15:28:53.974043 IP 172.217.1.69.443 > 10.31.24.241.62513: tcp 0
15:28:53.974464 IP 172.217.1.69.443 > 10.31.24.241.62513: tcp 0
15:28:53.974594 IP 172.217.1.69.443 > 10.31.24.241.62513: tcp 0
15:28:53.984001 IP 172.217.1.69.443 > 10.31.24.241.62513: tcp 0
15:28:53.984019 IP 172.217.1.69.443 > 10.31.24.241.62513: tcp 0
15:28:53.984027 IP 172.217.1.69.443 > 10.31.24.241.62513: tcp 0
15:28:54.002479 IP 10.31.24.241.62513 > 172.217.1.69.443: tcp 1368
15:28:54.002501 IP 10.31.24.241.62513 > 172.217.1.69.443: tcp 1368
15:28:54.002508 IP 10.31.24.241.62513 > 172.217.1.69.443: tcp 275
15:28:54.028765 IP 172.217.1.69.443 > 10.31.24.241.62513: tcp 287
15:28:54.028782 IP 172.217.1.69.443 > 10.31.24.241.62513: tcp 195
15:28:54.028821 IP 10.31.24.241.62513 > 172.217.1.69.443: tcp 0
15:28:54.028842 IP 10.31.24.241.62513 > 172.217.1.69.443: tcp 0
15:28:54.036944 IP 172.217.1.69.443 > 10.31.24.241.62513: tcp 268
15:28:54.036995 IP 10.31.24.241.62513 > 172.217.1.69.443: tcp 0
15:28:54.037012 IP 172.217.1.69.443 > 10.31.24.241.62513: tcp 39
15:28:54.037036 IP 10.31.24.241.62513 > 172.217.1.69.443: tcp 0
15:28:54.037808 IP 10.31.24.241.62513 > 172.217.1.69.443: tcp 39
15:28:54.038012 IP 172.217.1.69.443 > 10.31.24.241.62513: tcp 0
15:28:54.038025 IP 172.217.1.69.443 > 10.31.24.241.62513: tcp 0
15:28:54.038033 IP 172.217.1.69.443 > 10.31.24.241.62513: tcp 0
15:28:54.046962 IP 172.217.1.69.443 > 10.31.24.241.62513: tcp 881
15:28:54.047009 IP 172.217.1.69.443 > 10.31.24.241.62513: tcp 698
15:28:54.047133 IP 10.31.24.241.62513 > 172.217.1.69.443: tcp 0
15:28:54.047206 IP 10.31.24.241.62513 > 172.217.1.69.443: tcp 0
15:28:54.054692 IP 172.217.1.69.443 > 10.31.24.241.62513: tcp 38
15:28:54.054739 IP 10.31.24.241.62513 > 172.217.1.69.443: tcp 0
15:28:54.065754 IP 10.31.24.241.10222 > 129.186.140.200.53: UDP, length 34
15:28:54.065927 IP 10.31.24.241.63378 > 129.186.140.200.53: UDP, length 34
15:28:54.079505 IP 129.186.140.200.53 > 10.31.24.241.63378: UDP, length 62
15:28:54.079525 IP 129.186.140.200.53 > 10.31.24.241.10222: UDP, length 50
15:28:54.147973 IP 10.31.24.241.62513 > 172.217.1.69.443: tcp 39
15:28:54.169977 IP 172.217.1.69.443 > 10.31.24.241.62513: tcp 0
15:28:54.204949 IP 172.217.1.69.443 > 10.31.24.241.62513: tcp 0
15:28:54.467969 IP 10.31.24.241.62513 > 172.217.1.69.443: tcp 1355
15:28:54.468047 IP 10.31.24.241.62513 > 172.217.1.69.443: tcp 374
15:28:54.503870 IP 172.217.1.69.443 > 10.31.24.241.62513: tcp 0
15:28:54.503888 IP 172.217.1.69.443 > 10.31.24.241.62513: tcp 0
15:28:54.686003 IP 10.31.27.252.1985 > 224.0.0.102.1985: UDP, length 52
15:28:54.686015 IP 10.31.25.98.5353 > 224.0.0.251.5353: UDP, length 241
15:28:54.790759 IP 10.31.25.146.5353 > 224.0.0.251.5353: UDP, length 439
15:28:54.790972 IP 10.33.14.183.5353 > 224.0.0.251.5353: UDP, length 389
15:28:54.791450 IP 172.217.1.69.443 > 10.31.24.241.62513: tcp 369
15:28:54.791457 IP 172.217.1.69.443 > 10.31.24.241.62513: tcp 60
15:28:54.791462 IP 172.217.1.69.443 > 10.31.24.241.62513: tcp 31
15:28:54.791487 IP 10.31.24.241.62513 > 172.217.1.69.443: tcp 0
15:28:54.791498 IP 10.31.24.241.62513 > 172.217.1.69.443: tcp 0
15:28:54.791504 IP 10.31.24.241.62513 > 172.217.1.69.443: tcp 0
15:28:54.791614 IP 172.217.1.69.443 > 10.31.24.241.62513: tcp 39
15:28:54.791637 IP 10.31.24.241.62513 > 172.217.1.69.443: tcp 0
15:28:54.792560 IP 10.31.24.241.62513 > 172.217.1.69.443: tcp 39
15:28:54.814795 IP 172.217.1.69.443 > 10.31.24.241.62513: tcp 39
15:28:54.814827 IP 10.31.24.241.62513 > 172.217.1.69.443: tcp 0
15:28:54.827766 IP 172.217.1.69.443 > 10.31.24.241.62513: tcp 0
15:28:54.831758 IP 172.217.1.69.443 > 10.31.24.241.62513: tcp 240
15:28:54.831768 IP 172.217.1.69.443 > 10.31.24.241.62513: tcp 1418
15:28:54.831774 IP 172.217.1.69.443 > 10.31.24.241.62513: tcp 156
15:28:54.831779 IP 172.217.1.69.443 > 10.31.24.241.62513: tcp 1418
15:28:54.831784 IP 172.217.1.69.443 > 10.31.24.241.62513: tcp 69
15:28:54.831789 IP 172.217.1.69.443 > 10.31.24.241.62513: tcp 39
15:28:54.831814 IP 10.31.24.241.62513 > 172.217.1.69.443: tcp 0
15:28:54.831824 IP 10.31.24.241.62513 > 172.217.1.69.443: tcp 0
15:28:54.831843 IP 10.31.24.241.62513 > 172.217.1.69.443: tcp 0
15:28:54.831850 IP 10.31.24.241.62513 > 172.217.1.69.443: tcp 0
15:28:54.831855 IP 10.31.24.241.62513 > 172.217.1.69.443: tcp 0
15:28:54.831860 IP 10.31.24.241.62513 > 172.217.1.69.443: tcp 0
15:28:54.833022 IP 10.31.24.241.62513 > 172.217.1.69.443: tcp 39
15:28:54.895044 IP 10.33.15.117.5353 > 224.0.0.251.5353: UDP, length 393
15:28:54.907316 IP 172.217.1.69.443 > 10.31.24.241.62513: tcp 0
15:28:56.043835 IP 10.31.27.253.1985 > 224.0.0.102.1985: UDP, length 52
15:28:56.357179 IP 10.31.26.216.5353 > 224.0.0.251.5353: UDP, length 200
15:28:56.461724 IP 10.31.25.98.5353 > 224.0.0.251.5353: UDP, length 66
15:28:57.401702 IP 10.31.27.252.1985 > 224.0.0.102.1985: UDP, length 52
15:28:57.506106 IP 10.31.25.98.5353 > 224.0.0.251.5353: UDP, length 66
15:28:57.506645 IP 10.33.15.107.5353 > 224.0.0.251.5353: UDP, length 70
15:28:57.715170 IP 10.31.25.98.5353 > 224.0.0.251.5353: UDP, length 346
15:28:58.132791 IP 10.33.15.134.5353 > 224.0.0.251.5353: UDP, length 61
15:28:58.446216 IP 10.33.15.107.5353 > 224.0.0.251.5353: UDP, length 70
15:28:58.550627 IP 10.31.24.16.5353 > 224.0.0.251.5353: UDP, length 77
15:28:58.759434 IP 10.31.27.253.1985 > 224.0.0.102.1985: UDP, length 52
15:28:59.209634 IP 10.31.24.241.62513 > 172.217.1.69.443: tcp 665
15:28:59.209720 IP 10.31.24.241.62513 > 172.217.1.69.443: tcp 309
15:28:59.245498 IP 172.217.1.69.443 > 10.31.24.241.62513: tcp 0
15:28:59.245515 IP 172.217.1.69.443 > 10.31.24.241.62513: tcp 0
15:28:59.355719 IP 10.31.24.241.53060 > 129.186.140.200.53: UDP, length 32
15:28:59.355940 IP 10.31.24.241.51801 > 129.186.140.200.53: UDP, length 32
15:28:59.357140 IP 10.31.24.241.53060 > 129.186.140.200.53: UDP, length 32
15:28:59.357299 IP 10.31.24.241.64052 > 129.186.140.200.53: UDP, length 41
15:28:59.357425 IP 10.31.24.241.60758 > 129.186.140.200.53: UDP, length 41
15:28:59.369928 IP 129.186.140.200.53 > 10.31.24.241.53060: UDP, length 48
15:28:59.369940 IP 129.186.140.200.53 > 10.31.24.241.51801: UDP, length 60
15:28:59.369948 IP 129.186.140.200.53 > 10.31.24.241.53060: UDP, length 48
15:28:59.369954 IP 129.186.140.200.53 > 10.31.24.241.64052: UDP, length 105
15:28:59.369961 IP 129.186.140.200.53 > 10.31.24.241.60758: UDP, length 69
15:28:59.387355 IP 10.31.24.241.51006 > 129.186.140.200.53: UDP, length 32
15:28:59.388462 IP 10.31.24.241.52978 > 129.186.140.200.53: UDP, length 32
15:28:59.400763 IP 129.186.140.200.53 > 10.31.24.241.51006: UDP, length 141
15:28:59.400778 IP 129.186.140.200.53 > 10.31.24.241.52978: UDP, length 183
15:28:59.431617 IP 172.217.1.69.443 > 10.31.24.241.62513: tcp 240
15:28:59.431630 IP 172.217.1.69.443 > 10.31.24.241.62513: tcp 1418
15:28:59.431638 IP 172.217.1.69.443 > 10.31.24.241.62513: tcp 150
15:28:59.431644 IP 172.217.1.69.443 > 10.31.24.241.62513: tcp 1418
15:28:59.431679 IP 10.31.24.241.62513 > 172.217.1.69.443: tcp 0
15:28:59.431693 IP 10.31.24.241.62513 > 172.217.1.69.443: tcp 0
15:28:59.431713 IP 10.31.24.241.62513 > 172.217.1.69.443: tcp 0
15:28:59.431721 IP 10.31.24.241.62513 > 172.217.1.69.443: tcp 0
15:28:59.434522 IP 172.217.1.69.443 > 10.31.24.241.62513: tcp 84
15:28:59.434535 IP 172.217.1.69.443 > 10.31.24.241.62513: tcp 39
15:28:59.434563 IP 10.31.24.241.62513 > 172.217.1.69.443: tcp 0
15:28:59.434577 IP 10.31.24.241.62513 > 172.217.1.69.443: tcp 0
15:28:59.435174 IP 10.31.24.241.62513 > 172.217.1.69.443: tcp 39
15:28:59.470396 IP 172.217.1.69.443 > 10.31.24.241.62513: tcp 0
15:29:00.039598 IP 10.31.24.241.62513 > 172.217.1.69.443: tcp 1194
15:29:00.039676 IP 10.31.24.241.62513 > 172.217.1.69.443: tcp 579
15:29:00.075311 IP 172.217.1.69.443 > 10.31.24.241.62513: tcp 0
15:29:00.075329 IP 172.217.1.69.443 > 10.31.24.241.62513: tcp 0
15:29:00.117312 IP 10.31.27.252.1985 > 224.0.0.102.1985: UDP, length 52
15:29:00.117326 IP 10.33.15.107.5353 > 224.0.0.251.5353: UDP, length 93
15:29:00.198985 IP 172.217.1.69.443 > 10.31.24.241.62513: tcp 215
15:29:00.199002 IP 172.217.1.69.443 > 10.31.24.241.62513: tcp 212
15:29:00.199035 IP 10.31.24.241.62513 > 172.217.1.69.443: tcp 0
15:29:00.199049 IP 10.31.24.241.62513 > 172.217.1.69.443: tcp 0
15:29:00.201660 IP 172.217.1.69.443 > 10.31.24.241.62513: tcp 267
15:29:00.201673 IP 172.217.1.69.443 > 10.31.24.241.62513: tcp 39
15:29:00.201700 IP 10.31.24.241.62513 > 172.217.1.69.443: tcp 0
15:29:00.201714 IP 10.31.24.241.62513 > 172.217.1.69.443: tcp 0
15:29:00.202095 IP 10.31.24.241.62513 > 172.217.1.69.443: tcp 39
15:29:00.236502 IP 172.217.1.69.443 > 10.31.24.241.62513: tcp 0
15:29:00.430639 IP 10.31.25.98.5353 > 224.0.0.251.5353: UDP, length 66
15:29:00.446188 IP 10.31.24.241.64458 > 129.186.140.200.53: UDP, length 39
15:29:00.447073 IP 10.31.24.241.57315 > 129.186.140.200.53: UDP, length 39
15:29:00.460374 IP 129.186.140.200.53 > 10.31.24.241.64458: UDP, length 55
15:29:00.460390 IP 129.186.140.200.53 > 10.31.24.241.57315: UDP, length 67
15:29:00.744013 IP 10.31.25.8.5353 > 224.0.0.251.5353: UDP, length 90
15:29:01.161778 IP 10.33.15.107.5353 > 224.0.0.251.5353: UDP, length 78
15:29:01.370735 IP 10.31.27.253.1985 > 224.0.0.102.1985: UDP, length 52
15:29:01.475107 IP 10.33.15.107.5353 > 224.0.0.251.5353: UDP, length 70
15:29:01.788440 IP 10.31.25.8.5353 > 224.0.0.251.5353: UDP, length 66
15:29:02.101822 IP 10.31.24.15.5353 > 224.0.0.251.5353: UDP, length 605
15:29:02.101893 IP 10.31.24.15.5353 > 224.0.0.251.5353: UDP, length 469
15:29:02.519681 IP 10.33.14.46.5353 > 224.0.0.251.5353: UDP, length 155
15:29:02.519745 IP 10.33.14.46.5353 > 224.0.0.251.5353: UDP, length 312
15:29:02.621983 IP 10.31.24.241.5353 > 10.33.14.46.5353: UDP, length 385
15:29:02.728552 IP 10.33.14.46.5353 > 224.0.0.251.5353: UDP, length 227
15:29:02.832952 IP 10.31.27.252.1985 > 224.0.0.102.1985: UDP, length 52
15:29:02.937365 IP 10.31.26.216.5353 > 224.0.0.251.5353: UDP, length 153
15:29:02.937506 IP 10.33.14.46.5353 > 224.0.0.251.5353: UDP, length 227
15:29:03.250835 IP 10.33.14.46.5353 > 224.0.0.251.5353: UDP, length 227
15:29:03.459707 IP 10.33.14.46.5353 > 224.0.0.251.5353: UDP, length 348
15:29:03.564107 IP 10.33.14.46.5353 > 224.0.0.251.5353: UDP, length 260
15:29:03.564424 IP 10.33.14.46.5353 > 224.0.0.251.5353: UDP, length 312
15:29:03.654711 IP 10.31.24.241.5353 > 224.0.0.251.5353: UDP, length 426
15:29:03.668521 IP 10.31.24.173.5353 > 224.0.0.251.5353: UDP, length 315
15:29:03.668783 IP 10.31.25.122.5353 > 224.0.0.251.5353: UDP, length 391
15:29:03.772962 IP 10.31.25.142.5353 > 224.0.0.251.5353: UDP, length 375
15:29:03.773145 IP 10.31.26.216.5353 > 224.0.0.251.5353: UDP, length 426
15:29:03.877482 IP 10.31.25.223.5353 > 224.0.0.251.5353: UDP, length 309
15:29:03.981893 IP 10.31.27.253.1985 > 224.0.0.102.1985: UDP, length 52
15:29:04.190913 IP 10.33.15.107.5353 > 224.0.0.251.5353: UDP, length 78
15:29:04.295331 IP 10.33.14.46.5353 > 224.0.0.251.5353: UDP, length 348
15:29:04.608682 IP 10.31.27.137.5353 > 224.0.0.251.5353: UDP, length 149
15:29:04.733941 IP 10.31.24.241.5353 > 10.31.27.137.5353: UDP, length 385
15:29:05.548564 IP 10.31.27.252.1985 > 224.0.0.102.1985: UDP, length 52
15:29:05.652989 IP 10.33.14.46.5353 > 224.0.0.251.5353: UDP, length 600
15:29:05.757527 IP 10.31.27.137.5353 > 224.0.0.251.5353: UDP, length 407
15:29:05.861909 IP 10.33.15.117.5353 > 224.0.0.251.5353: UDP, length 393
15:29:05.966418 IP 10.33.14.183.5353 > 224.0.0.251.5353: UDP, length 389
15:29:06.384135 IP 10.33.15.125.5353 > 224.0.0.251.5353: UDP, length 39
15:29:06.384200 IP 10.33.15.125.5353 > 224.0.0.251.5353: UDP, length 39
15:29:06.384457 IP 10.33.15.125.51862 > 224.0.0.252.5355: UDP, length 33
15:29:06.593051 IP 10.33.14.46.5353 > 224.0.0.251.5353: UDP, length 260
15:29:06.624439 IP 10.31.24.241.5353 > 224.0.0.251.5353: UDP, length 426
15:29:06.659434 IP 10.31.24.241.62513 > 172.217.1.69.443: tcp 1368
15:29:06.659454 IP 10.31.24.241.62513 > 172.217.1.69.443: tcp 804
15:29:06.693984 IP 172.217.1.69.443 > 10.31.24.241.62513: tcp 0
15:29:06.694000 IP 172.217.1.69.443 > 10.31.24.241.62513: tcp 0
15:29:06.697600 IP 10.31.27.253.1985 > 224.0.0.102.1985: UDP, length 52
15:29:06.697622 IP 10.31.24.173.5353 > 224.0.0.251.5353: UDP, length 315
15:29:06.698550 IP 10.31.25.142.5353 > 224.0.0.251.5353: UDP, length 375
15:29:06.698939 IP 10.31.26.216.5353 > 224.0.0.251.5353: UDP, length 426
15:29:06.759705 IP 172.217.1.69.443 > 10.31.24.241.62513: tcp 217
15:29:06.759724 IP 172.217.1.69.443 > 10.31.24.241.62513: tcp 674
15:29:06.759771 IP 10.31.24.241.62513 > 172.217.1.69.443: tcp 0
15:29:06.759792 IP 10.31.24.241.62513 > 172.217.1.69.443: tcp 0
15:29:06.767680 IP 172.217.1.69.443 > 10.31.24.241.62513: tcp 67
15:29:06.767718 IP 172.217.1.69.443 > 10.31.24.241.62513: tcp 39
15:29:06.767871 IP 10.31.24.241.62513 > 172.217.1.69.443: tcp 0
15:29:06.767947 IP 10.31.24.241.62513 > 172.217.1.69.443: tcp 0
15:29:06.770567 IP 10.31.24.241.62513 > 172.217.1.69.443: tcp 39
15:29:06.798182 IP 10.31.24.241.30619 > 129.186.140.200.53: UDP, length 40
15:29:06.798321 IP 10.31.24.241.29648 > 129.186.140.200.53: UDP, length 40
15:29:06.801966 IP 10.31.25.122.5353 > 224.0.0.251.5353: UDP, length 391
15:29:06.802204 IP 10.33.15.125.51862 > 224.0.0.252.5355: UDP, length 33
15:29:06.805592 IP 129.186.140.200.53 > 10.31.24.241.30619: UDP, length 138
15:29:06.805612 IP 129.186.140.200.53 > 10.31.24.241.29648: UDP, length 102
15:29:06.805633 IP 172.217.1.69.443 > 10.31.24.241.62513: tcp 0
15:29:06.906515 IP 10.31.25.223.5353 > 224.0.0.251.5353: UDP, length 309
15:29:07.239106 IP 10.31.24.241.62513 > 172.217.1.69.443: tcp 1368
15:29:07.239128 IP 10.31.24.241.62513 > 172.217.1.69.443: tcp 505
15:29:07.239281 IP 10.31.24.241.62513 > 172.217.1.69.443: tcp 252
15:29:07.274091 IP 172.217.1.69.443 > 10.31.24.241.62513: tcp 0
15:29:07.274109 IP 172.217.1.69.443 > 10.31.24.241.62513: tcp 0
15:29:07.274117 IP 172.217.1.69.443 > 10.31.24.241.62513: tcp 0
15:29:07.324137 IP 10.33.15.125.5353 > 224.0.0.251.5353: UDP, length 39
15:29:07.324457 IP 10.33.15.125.5353 > 224.0.0.251.5353: UDP, length 39
15:29:07.442409 IP 172.217.1.69.443 > 10.31.24.241.62513: tcp 239
15:29:07.442450 IP 172.217.1.69.443 > 10.31.24.241.62513: tcp 600
15:29:07.442483 IP 10.31.24.241.62513 > 172.217.1.69.443: tcp 0
15:29:07.442500 IP 10.31.24.241.62513 > 172.217.1.69.443: tcp 0
15:29:07.444195 IP 172.217.1.69.443 > 10.31.24.241.62513: tcp 38
15:29:07.444235 IP 172.217.1.69.443 > 10.31.24.241.62513: tcp 39
15:29:07.444429 IP 10.31.24.241.62513 > 172.217.1.69.443: tcp 0
15:29:07.444456 IP 10.31.24.241.62513 > 172.217.1.69.443: tcp 0
15:29:07.445866 IP 10.31.24.241.62513 > 172.217.1.69.443: tcp 39
15:29:07.480999 IP 172.217.1.69.443 > 10.31.24.241.62513: tcp 0
15:29:07.847185 IP 10.33.15.134.5353 > 224.0.0.251.5353: UDP, length 32
15:29:07.847582 IP 162.125.18.133.443 > 10.31.24.241.62330: tcp 257
15:29:07.847621 IP 10.31.24.241.62330 > 162.125.18.133.443: tcp 0
15:29:07.870507 IP 10.31.24.241.62330 > 162.125.18.133.443: tcp 465
15:29:07.903871 IP 162.125.18.133.443 > 10.31.24.241.62330: tcp 0
15:29:07.903917 IP 10.31.24.241.62330 > 162.125.18.133.443: tcp 958
15:29:07.937700 IP 162.125.18.133.443 > 10.31.24.241.62330: tcp 0
15:29:07.994077 IP 10.31.24.241.64456 > 239.255.255.250.1900: UDP, length 175
15:29:08.264146 IP 10.31.27.252.1985 > 224.0.0.102.1985: UDP, length 52
15:29:08.786475 IP 10.31.27.137.5353 > 224.0.0.251.5353: UDP, length 599
15:29:08.786672 IP 10.33.15.134.5353 > 224.0.0.251.5353: UDP, length 32
15:29:08.890914 IP 10.33.15.117.5353 > 224.0.0.251.5353: UDP, length 393
15:29:08.890986 IP 10.33.15.115.5353 > 224.0.0.251.5353: UDP, length 90
15:29:08.891222 IP 10.10.251.232 > 224.0.0.1: igmp
15:29:08.994260 IP 10.31.24.241.64456 > 239.255.255.250.1900: UDP, length 175
15:29:08.995823 IP 10.33.14.183.5353 > 224.0.0.251.5353: UDP, length 389
15:29:09.308714 IP 10.31.27.253.1985 > 224.0.0.102.1985: UDP, length 52
15:29:09.382878 IP 10.31.24.241.17500 > 255.255.255.255.17500: UDP, length 170
15:29:09.383294 IP 10.31.24.241.17500 > 10.31.27.255.17500: UDP, length 170
15:29:09.413243 IP 10.31.27.252 > 224.0.0.13: PIMv2, Hello, length 50
15:29:09.726501 IP 10.33.14.46.5353 > 224.0.0.251.5353: UDP, length 600
15:29:09.831017 IP 10.33.15.115.5353 > 224.0.0.251.5353: UDP, length 90
15:29:09.994356 IP 10.31.24.241.64456 > 239.255.255.250.1900: UDP, length 175
15:29:10.039838 IP 10.33.14.84.5353 > 224.0.0.251.5353: UDP, length 121
15:29:10.039959 IP 10.33.14.84.5353 > 224.0.0.251.5353: UDP, length 307
15:29:10.092298 IP 10.31.24.241.5353 > 10.33.14.84.5353: UDP, length 385
15:29:10.248688 IP 10.31.25.223.5353 > 224.0.0.251.5353: UDP, length 309
15:29:10.249023 IP 10.33.14.183.5353 > 224.0.0.251.5353: UDP, length 172
15:29:10.249422 IP 10.31.25.122.5353 > 224.0.0.251.5353: UDP, length 391
15:29:10.353172 IP 10.33.15.117.5353 > 224.0.0.251.5353: UDP, length 151
15:29:10.353251 IP 10.33.14.68.5353 > 224.0.0.251.5353: UDP, length 61
15:29:10.457594 IP 10.33.14.154.5353 > 224.0.0.251.5353: UDP, length 175
15:29:10.457679 IP 10.33.15.107.5353 > 224.0.0.251.5353: UDP, length 78
15:29:10.666496 IP 10.33.14.154.5353 > 224.0.0.251.5353: UDP, length 104
15:29:10.875201 IP 10.33.15.125.5353 > 224.0.0.251.5353: UDP, length 39
15:29:10.875499 IP 10.33.15.125.52684 > 224.0.0.252.5355: UDP, length 33
15:29:10.875788 IP 10.33.15.125.5353 > 224.0.0.251.5353: UDP, length 39
15:29:10.875810 IP 10.31.27.252.1985 > 224.0.0.102.1985: UDP, length 52
15:29:10.994407 IP 10.31.24.241.64456 > 239.255.255.250.1900: UDP, length 175
15:29:11.188758 IP 10.33.14.84.5353 > 224.0.0.251.5353: UDP, length 265
15:29:11.189254 IP 10.33.14.84.5353 > 224.0.0.251.5353: UDP, length 307
15:29:11.263380 IP 10.31.24.241.5353 > 224.0.0.251.5353: UDP, length 426
15:29:11.293441 IP 10.31.24.173.5353 > 224.0.0.251.5353: UDP, length 315
15:29:11.293645 IP 10.33.15.125.52684 > 224.0.0.252.5355: UDP, length 33
15:29:11.293833 IP 10.31.25.142.5353 > 224.0.0.251.5353: UDP, length 375
15:29:11.397584 IP 10.31.26.216.5353 > 224.0.0.251.5353: UDP, length 426
15:29:11.398067 IP 10.31.25.223.5353 > 224.0.0.251.5353: UDP, length 309
15:29:11.398254 IP 10.31.25.122.5353 > 224.0.0.251.5353: UDP, length 391
15:29:11.450474 IP 10.31.24.241 > 224.0.0.251: igmp
15:29:11.502132 IP 10.33.14.183.5353 > 224.0.0.251.5353: UDP, length 389
15:29:11.815325 IP 10.33.15.134.5353 > 224.0.0.251.5353: UDP, length 32
15:29:11.815393 IP 10.33.15.125.5353 > 224.0.0.251.5353: UDP, length 39
15:29:11.815665 IP 10.33.15.125.5353 > 224.0.0.251.5353: UDP, length 39
15:29:11.919872 IP 10.33.14.154.5353 > 224.0.0.251.5353: UDP, length 146
15:29:12.024377 IP 10.31.27.253.1985 > 224.0.0.102.1985: UDP, length 52
15:29:12.233968 IP 10.31.24.62.5353 > 224.0.0.251.5353: UDP, length 61
15:29:12.234390 IP 107.152.27.219.443 > 10.31.24.241.62554: tcp 387
15:29:12.234422 IP 10.31.24.241.62554 > 107.152.27.219.443: tcp 0
15:29:12.239015 IP 10.31.24.241.62554 > 107.152.27.219.443: tcp 0
15:29:12.257372 IP 10.31.24.241.54801 > 129.186.140.200.53: UDP, length 45
15:29:12.270899 IP 129.186.140.200.53 > 10.31.24.241.54801: UDP, length 61
15:29:12.271378 IP 10.31.24.241.62559 > 107.152.26.219.443: tcp 0
15:29:12.279826 IP 107.152.27.219.443 > 10.31.24.241.62554: tcp 0
15:29:12.279871 IP 10.31.24.241.62554 > 107.152.27.219.443: tcp 0
15:29:12.306704 IP 107.152.26.219.443 > 10.31.24.241.62559: tcp 0
15:29:12.306746 IP 10.31.24.241.62559 > 107.152.26.219.443: tcp 0
15:29:12.331356 IP 10.31.24.241.62559 > 107.152.26.219.443: tcp 517
15:29:12.338549 IP 10.31.24.241.62452 > 192.30.253.124.443: tcp 0
15:29:12.367910 IP 107.152.26.219.443 > 10.31.24.241.62559: tcp 0
15:29:12.367954 IP 107.152.26.219.443 > 10.31.24.241.62559: tcp 1448
15:29:12.367964 IP 107.152.26.219.443 > 10.31.24.241.62559: tcp 509
15:29:12.367973 IP 107.152.26.219.443 > 10.31.24.241.62559: tcp 1448
15:29:12.368097 IP 10.31.24.241.62559 > 107.152.26.219.443: tcp 0
15:29:12.368114 IP 10.31.24.241.62559 > 107.152.26.219.443: tcp 0
15:29:12.373025 IP 10.31.24.241.62559 > 107.152.26.219.443: tcp 126
15:29:12.374404 IP 192.30.253.124.443 > 10.31.24.241.62452: tcp 0
15:29:12.408280 IP 107.152.26.219.443 > 10.31.24.241.62559: tcp 274
15:29:12.408379 IP 10.31.24.241.62559 > 107.152.26.219.443: tcp 0
15:29:12.415744 IP 10.31.24.241.62559 > 107.152.26.219.443: tcp 294
15:29:12.490830 IP 107.152.26.219.443 > 10.31.24.241.62559: tcp 0
15:29:12.859902 IP 10.33.14.84.5353 > 224.0.0.251.5353: UDP, length 66
15:29:12.964344 IP 10.33.15.115.5353 > 224.0.0.251.5353: UDP, length 90
15:29:13.173316 IP 10.31.27.253 > 224.0.0.13: PIMv2, Hello, length 50
15:29:13.173344 IP 10.33.14.154.5353 > 224.0.0.251.5353: UDP, length 436
15:29:13.173754 IP 10.33.14.84.5353 > 224.0.0.251.5353: UDP, length 307
15:29:13.174096 IP 10.31.25.44.60606 > 224.0.0.252.5355: UDP, length 22
15:29:13.591070 IP 10.31.25.44.60606 > 224.0.0.252.5355: UDP, length 22
15:29:13.591084 IP 10.31.27.252.1985 > 224.0.0.102.1985: UDP, length 52
15:29:13.904651 IP 10.33.14.84.5353 > 224.0.0.251.5353: UDP, length 66
15:29:14.113298 IP 10.33.14.84.5353 > 224.0.0.251.5353: UDP, length 397
15:29:14.113468 IP 10.33.14.154.5353 > 224.0.0.251.5353: UDP, length 346
15:29:14.217702 IP 10.31.25.122.5353 > 224.0.0.251.5353: UDP, length 391
15:29:14.218117 IP 10.31.25.146.5353 > 224.0.0.251.5353: UDP, length 439
15:29:14.218540 IP 10.31.24.173.5353 > 224.0.0.251.5353: UDP, length 315
15:29:14.218988 IP 10.31.26.216.5353 > 224.0.0.251.5353: UDP, length 426
15:29:14.296931 IP 10.31.24.241.5353 > 224.0.0.251.5353: UDP, length 426
15:29:14.322294 IP 10.31.25.142.5353 > 224.0.0.251.5353: UDP, length 375
15:29:14.322416 IP 10.33.14.183.5353 > 224.0.0.251.5353: UDP, length 389
15:29:14.323056 IP 10.31.25.223.5353 > 224.0.0.251.5353: UDP, length 309
15:29:14.426973 IP 10.33.15.117.5353 > 224.0.0.251.5353: UDP, length 393
15:29:14.635633 IP 10.31.27.253.1985 > 224.0.0.102.1985: UDP, length 52
15:29:14.844419 IP 10.33.14.84.5353 > 224.0.0.251.5353: UDP, length 223
15:29:15.157856 IP 10.33.14.84.5353 > 224.0.0.251.5353: UDP, length 223
15:29:15.157937 IP 10.33.14.154.5353 > 224.0.0.251.5353: UDP, length 313
15:29:15.158132 IP 10.33.14.154.5353 > 224.0.0.251.5353: UDP, length 308
15:29:15.366666 IP 10.33.14.84.5353 > 224.0.0.251.5353: UDP, length 223
15:29:15.597525 IP 10.31.24.241.62551 > 107.152.26.197.443: tcp 0
15:29:15.609223 IP 10.31.24.241.55903 > 129.186.140.200.53: UDP, length 36
15:29:15.609799 IP 10.31.24.241.59906 > 129.186.140.200.53: UDP, length 36
15:29:15.623176 IP 129.186.140.200.53 > 10.31.24.241.55903: UDP, length 68
15:29:15.623195 IP 129.186.140.200.53 > 10.31.24.241.59906: UDP, length 114
15:29:15.625894 IP 10.31.24.241.62560 > 107.152.24.197.443: tcp 0
15:29:15.675734 IP 107.152.24.197.443 > 10.31.24.241.62560: tcp 0
15:29:15.675795 IP 10.31.24.241.62560 > 107.152.24.197.443: tcp 0
15:29:15.680105 IP 10.33.14.154.5353 > 224.0.0.251.5353: UDP, length 182
15:29:15.680214 IP 10.33.14.84.5353 > 224.0.0.251.5353: UDP, length 344
15:29:15.765935 IP 10.31.24.241.62560 > 107.152.24.197.443: tcp 517
15:29:15.814055 IP 107.152.24.197.443 > 10.31.24.241.62560: tcp 0
15:29:15.816014 IP 107.152.24.197.443 > 10.31.24.241.62560: tcp 1448
15:29:15.816030 IP 107.152.24.197.443 > 10.31.24.241.62560: tcp 483
15:29:15.816041 IP 107.152.24.197.443 > 10.31.24.241.62560: tcp 1448
15:29:15.816327 IP 10.31.24.241.62560 > 107.152.24.197.443: tcp 0
15:29:15.816350 IP 10.31.24.241.62560 > 107.152.24.197.443: tcp 0
15:29:15.817925 IP 10.31.24.241.62560 > 107.152.24.197.443: tcp 126
15:29:15.866815 IP 107.152.24.197.443 > 10.31.24.241.62560: tcp 258
15:29:15.866871 IP 10.31.24.241.62560 > 107.152.24.197.443: tcp 0
15:29:15.870547 IP 10.31.24.241.62560 > 107.152.24.197.443: tcp 914
15:29:15.888972 IP 10.33.14.154.5353 > 224.0.0.251.5353: UDP, length 182
15:29:15.958314 IP 107.152.24.197.443 > 10.31.24.241.62560: tcp 0
15:29:15.966413 IP 107.152.24.197.443 > 10.31.24.241.62560: tcp 801
15:29:15.966555 IP 10.31.24.241.62560 > 107.152.24.197.443: tcp 0
15:29:16.097908 IP 10.33.14.154.5353 > 224.0.0.251.5353: UDP, length 508
15:29:16.098269 IP 10.33.14.154.5353 > 224.0.0.251.5353: UDP, length 308
15:29:16.202200 IP 10.31.25.146.5353 > 224.0.0.251.5353: UDP, length 439
15:29:16.306702 IP 10.31.27.252.1985 > 224.0.0.102.1985: UDP, length 52
15:29:16.411134 IP 10.33.14.154.5353 > 224.0.0.251.5353: UDP, length 275
15:29:16.515583 IP 10.31.27.11.5353 > 224.0.0.251.5353: UDP, length 112
15:29:16.515653 IP 10.33.15.125.5353 > 224.0.0.251.5353: UDP, length 39
15:29:16.515860 IP 10.33.15.125.5353 > 224.0.0.251.5353: UDP, length 39
15:29:16.516329 IP 10.33.15.125.54874 > 224.0.0.252.5355: UDP, length 33
15:29:16.652724 IP 10.31.24.241.5353 > 10.31.27.11.5353: UDP, length 385
15:29:16.724512 IP 10.33.14.84.5353 > 224.0.0.251.5353: UDP, length 344
15:29:16.933382 IP 10.33.15.125.54874 > 224.0.0.252.5355: UDP, length 33
15:29:17.142256 IP 10.33.14.154.5353 > 224.0.0.251.5353: UDP, length 528
15:29:17.246743 IP 10.31.27.253.1985 > 224.0.0.102.1985: UDP, length 52
15:29:17.351149 IP 10.33.14.84.5353 > 224.0.0.251.5353: UDP, length 307
15:29:17.455609 IP 10.31.27.11.5353 > 224.0.0.251.5353: UDP, length 499
15:29:17.560383 IP 10.33.15.125.5353 > 224.0.0.251.5353: UDP, length 39
15:29:17.560778 IP 10.33.15.125.5353 > 224.0.0.251.5353: UDP, length 39
15:29:17.664481 IP 10.33.14.183.5353 > 224.0.0.251.5353: UDP, length 389
15:29:17.769162 IP 10.33.15.117.5353 > 224.0.0.251.5353: UDP, length 393
15:29:18.500103 IP 10.31.24.16.5353 > 224.0.0.251.5353: UDP, length 77
15:29:18.917920 IP 10.33.14.84.5353 > 224.0.0.251.5353: UDP, length 344
15:29:19.126839 IP 10.31.27.252.1985 > 224.0.0.102.1985: UDP, length 52
15:29:19.126855 IP 10.33.14.154.5353 > 224.0.0.251.5353: UDP, length 346
15:29:19.127236 IP 10.33.14.154.5353 > 224.0.0.251.5353: UDP, length 275
15:29:19.544397 IP 10.31.27.11.5353 > 224.0.0.251.5353: UDP, length 89
15:29:19.962436 IP 10.31.25.122.5353 > 224.0.0.251.5353: UDP, length 650
15:29:19.962690 IP 10.31.27.253.1985 > 224.0.0.102.1985: UDP, length 52
15:29:20.171282 IP 10.33.14.84.5353 > 224.0.0.251.5353: UDP, length 133
15:29:20.380233 IP 10.33.14.84.5353 > 224.0.0.251.5353: UDP, length 133
15:29:20.693498 IP 10.33.14.84.5353 > 224.0.0.251.5353: UDP, length 133
15:29:20.902617 IP 10.33.15.134.5353 > 224.0.0.251.5353: UDP, length 32
15:29:20.902833 IP 10.33.14.84.5353 > 224.0.0.251.5353: UDP, length 147
15:29:21.111385 IP 10.33.15.125.5353 > 224.0.0.251.5353: UDP, length 39
15:29:21.111441 IP 10.33.15.125.5353 > 224.0.0.251.5353: UDP, length 39
15:29:21.111572 IP 10.33.15.125.64309 > 224.0.0.252.5355: UDP, length 33
15:29:21.216469 IP 10.33.14.154.5353 > 224.0.0.251.5353: UDP, length 528
15:29:21.216889 IP 192.30.253.124.443 > 10.31.24.241.62452: tcp 24
15:29:21.216930 IP 10.31.24.241.62452 > 192.30.253.124.443: tcp 0
15:29:21.217019 IP 10.31.24.241.62452 > 192.30.253.124.443: tcp 28
15:29:21.252739 IP 192.30.253.124.443 > 10.31.24.241.62452: tcp 0
15:29:21.424691 IP 10.33.14.84.5353 > 224.0.0.251.5353: UDP, length 133
15:29:21.529088 IP 10.33.15.125.64309 > 224.0.0.252.5355: UDP, length 33
15:29:21.738296 IP 10.33.14.84.5353 > 224.0.0.251.5353: UDP, length 133
15:29:21.842439 IP 10.31.27.252.1985 > 224.0.0.102.1985: UDP, length 52
15:29:22.051392 IP 10.33.14.84.5353 > 224.0.0.251.5353: UDP, length 133
15:29:22.051624 IP 10.33.15.125.5353 > 224.0.0.251.5353: UDP, length 39
15:29:22.051822 IP 10.33.15.125.5353 > 224.0.0.251.5353: UDP, length 39
15:29:22.260207 IP 10.33.14.84.5353 > 224.0.0.251.5353: UDP, length 147
15:29:22.469187 IP 10.33.14.68.5353 > 224.0.0.251.5353: UDP, length 114
15:29:22.573565 IP 10.31.27.253.1985 > 224.0.0.102.1985: UDP, length 52
15:29:22.816798 IP 10.31.24.241.62557 > 23.54.44.251.443: tcp 0
15:29:22.824726 IP 23.54.44.251.443 > 10.31.24.241.62557: tcp 0
15:29:22.991309 IP 10.33.14.84.5353 > 224.0.0.251.5353: UDP, length 344
15:29:24.036174 IP 10.31.27.137.5353 > 224.0.0.251.5353: UDP, length 97
15:29:24.086050 IP 10.31.24.241.5353 > 10.31.27.137.5353: UDP, length 385
15:29:24.558059 IP 10.31.27.252.1985 > 224.0.0.102.1985: UDP, length 52
15:29:24.871444 IP 10.33.14.183.5353 > 224.0.0.251.5353: UDP, length 57
15:29:25.080249 IP 10.31.27.137.5353 > 224.0.0.251.5353: UDP, length 351
15:29:25.080446 IP 10.33.14.84.5353 > 224.0.0.251.5353: UDP, length 152
15:29:25.184791 IP 10.33.14.183.5353 > 224.0.0.251.5353: UDP, length 389
15:29:25.289208 IP 10.31.27.253.1985 > 224.0.0.102.1985: UDP, length 52
15:29:25.289223 IP 10.33.15.117.5353 > 224.0.0.251.5353: UDP, length 393
15:29:25.498142 IP 10.33.14.123.5353 > 224.0.0.251.5353: UDP, length 139
15:29:25.498247 IP 10.33.14.123.5353 > 224.0.0.251.5353: UDP, length 306
15:29:25.551506 IP 10.31.24.241.5353 > 10.33.14.123.5353: UDP, length 385
15:29:25.602470 IP 10.31.27.113.65038 > 224.0.0.252.5355: UDP, length 22
15:29:25.602644 IP 10.31.27.113.53306 > 224.0.0.252.5355: UDP, length 22
15:29:25.915870 IP 10.33.14.123.5353 > 224.0.0.251.5353: UDP, length 180
15:29:25.915936 IP 10.31.27.113.65038 > 224.0.0.252.5355: UDP, length 22
15:29:25.916205 IP 10.31.27.113.53306 > 224.0.0.252.5355: UDP, length 22
15:29:26.229367 IP 10.33.14.123.5353 > 224.0.0.251.5353: UDP, length 180
15:29:26.333720 IP 10.33.14.154.5353 > 224.0.0.251.5353: UDP, length 83
15:29:26.334193 IP 10.31.27.113.59345 > 224.0.0.252.5355: UDP, length 22
